{
  "$schema": "../schemas/uebersetzungen.schema.json",
  "sprache": "SächScript",
  "version": 1,
  "text": {
    "anfang": "hochkommauff",
    "ende": "hochkommazu",
    "wortschutz": "wOrt"
  },
  "regeln": {
    "schluesselwoerter": {
      "machema": "function",
      "vonhausaus": "default",
      "dings": "var",
      "dauerdings": "const",
      "änderdings": "let",
      "wenn": "if",
      "sonst": "else",
      "fertsch": "break",
      "weiter": "continue",
      "probiermal": "switch",
      "wenndas": "case",
      "aufzähldings": "enum",
      "gibbe": "return",
      "gibweiter": "yield",
      "solange": "while",
      "machma": "do",
      "fuer": "for",
      "von": "of",
      "holrein": "import",
      "gibraus": "export",
      "aus": "from",
      "namensdings": "namespace",
      "baustein": "module",
      "überall": "global",
      "versuchma": "try",
      "fangab": "catch",
      "amende": "finally",
      "schmeiss": "throw",
      "wardema": "await",
      "nebenbei": "async",
      "benutzma": "using",
      "später": "defer",
      "neu": "new",
      "drinne": "in",
      "machweg": "delete",
      "sonding": "class",
      "erbtvon": "extends",
      "machtswie": "implements",
      "bauplan": "interface",
      "bauarbeiter": "constructor",
      "dasda": "this",
      "obersonding": "super",
      "füralle": "public",
      "fürmich": "private",
      "geschützt": "protected",
      "fest": "static",
      "nurguggen": "readonly",
      "nuridee": "abstract",
      "holma": "get",
      "setzma": "set",
      "zugriff": "accessor",
      "überschreib": "override",
      "isseinsvon": "instanceof",
      "schlüsselvon": "keyof"
    },
    "typen": {
      "jane": "boolean",
      "schrift": "string",
      "nummer": "number",
      "riesennummer": "bigint",
      "zeuch": "object",
      "merkzeichen": "symbol",
      "ohnewert": "void",
      "irgendwas": "unknown",
      "egalwas": "any",
      "niemals": "never"
    },
    "typoperatoren": {
      "art": "type",
      "als": "as",
      "erfüllt": "satisfies",
      "artvon": "typeof",
      "abgeleitet": "infer",
      "ist": "is",
      "versichert": "asserts",
      "angekündigt": "declare",
      "einzig": "unique"
    },
    "werte": {
      "nuja": "true",
      "nee": "false",
      "nix": "null",
      "weessnisch": "undefined"
    },
    "operatoren": {
      "machmehr": "+",
      "machweniger": "-",
      "machmal": "*",
      "machmaldurch": "/",
      "rest": "%",
      "issgleich": "=",
      "isswirklichgleich": "===",
      "issungefährgleich": "==",
      "issnichgleich": "!=",
      "isswirklichnichgleich": "!==",
      "kleener": "<",
      "groesser": ">",
      "kleenergleich": "<=",
      "groessergleich": ">=",
      "und": "&&",
      "oder": "||",
      "nicht": "!",
      "pfeil": "=>"
    },
    "moderne_operatoren": {
      "undsoweiter": "...",
      "vielleichtpunkt": "?.",
      "wennnix": "??",
      "hoch": "**",
      "machmehrmehr": "++",
      "machwenigerweniger": "--"
    },
    "zusammengesetzte_zuweisungen": {
      "machmehrgleich": "+=",
      "machwenigergleich": "-=",
      "machmalgleich": "*=",
      "hochgleich": "**=",
      "machmaldurchgleich": "/=",
      "restgleich": "%=",
      "undgleich": "&&=",
      "odergleich": "||=",
      "wennnixgleich": "??="
    },
    "zeichen": {
      "ät": "@",
      "klammeruff": "(",
      "klammerzu": ")",
      "eckigeauf": "[",
      "eckigezu": "]",
      "geschweifteauf": "{",
      "geschweiftezu": "}",
      "komma": ",",
      "punkt": ".",
      "doppelpunkt": ":",
      "semikolon": ";",
      "fragezeichen": "?"
    }
  }
}
